{
  "challenge_participants": [
    {
      "label": "ASFL-HULAFE-Submodule",
      "metric_id": "DS",
      "values": [
        0.773483572760095,
        0.7540018561895081,
        0.7506684896368983,
        0.8061947340364144,
        0.6556722974210268,
        0.6800505658560078,
        0.48472873336725747,
        0.7836756004176819,
        0.8885440651383189,
        0.7164738614731293,
        0.8042074526329761,
        0.8057446679621061,
        0.5361080039570415,
        0.7908183722210185,
        0.6965158240986172,
        0.6113890328171785,
        0.7895869191049913,
        0.14175175494575623,
        0.8536041589610817,
        0.8537994755899613,
        0.498619305019305,
        0.5826573426573427,
        0.4818758852226827,
        0.6316517302722116,
        0.8303689772873895,
        0.12365477618140633,
        0.6266124303723248,
        0.3069806479918357,
        0.8350978493248306,
        0.7653920111213147,
        0.6128107958221647,
        0.8963605324721434,
        0.07514430229098483,
        0.016278703994966972,
        0.6343961341283249,
        0.8060100204579653,
        0.7213164663272269,
        0.34309373487275086,
        0.619093248644801,
        0.6387945056161596,
        0.5504535546023487,
        0.9046427817323556,
        0.5512294539583389,
        0.6102897322409517,
        0.7652107028651601,
        0.7155585254482681,
        0.816117222650798,
        0.841813067325748,
        0.8466046751615219,
        0.8033332555884676
      ]
    },
    {
      "label": "ASFL-HULAFE",
      "metric_id": "DS",
      "values": [
        0.9259426739970329,
        0.8986458716390144,
        0.8056844352075493,
        0.851773404705973,
        0.7558710269317592,
        0.20690316339307244,
        0.6387673361175649,
        0.7121014324290491,
        0.9182787253141831,
        0.7293347497774842,
        0.8133492822966507,
        0.9229161000815882,
        0.5435351732940855,
        0.8338263984169967,
        0.6962513599947249,
        0.5993001714121273,
        0.908937352201494,
        0.06588639342039858,
        0.896322691433021,
        0.8266321873101429,
        0.8871165107945109,
        0.7441529318887399,
        0.4280987370481413,
        0.726338070758996,
        0.8575296902819354,
        0.4764708868470481,
        0.7263192452569375,
        0.44280085712310774,
        0.8806608520630661,
        0.8413816246347159,
        0.043553312973044746,
        0.8915620607764261,
        0.11979687469364547,
        0.4527761703164499,
        0.8254607638229147,
        0.890032665814515,
        0.7795205592972623,
        0.3153873441209376,
        0.7000086387491091,
        0.6651431960610725,
        0.559808284833961,
        0.9317090056232162,
        0.3148907422075199,
        0.8061501587261114,
        0.5766367075492157,
        0.7804631858762163,
        0.8258042886332643,
        0.8154259063709961,
        0.8209998808179295,
        0.7024868299424736
      ]
    },
    {
      "label": "MITS-ErasmusMC",
      "metric_id": "DS",
      "values": [
        0.7440079836198146,
        0.6478731605939732,
        0.731805836061007,
        0.6665310711480985,
        0.8014581336517763,
        0.8657577191529634,
        0.5825499043122354,
        0.7585692745853577,
        0.6399530950424541,
        0.3529230926884255,
        0.33681525567836756,
        0.4126292397124297,
        0.4219602092978879,
        0.46688561113500004,
        0.48746124136430397,
        0.6603457172342622,
        0.7664874409369754,
        0.6127560431026114,
        0.7128328741965105,
        0.5747368216979121,
        0.41238596834355484,
        0.5996640759664429,
        0.6425786779919417,
        0.18852565103876107,
        0.7468281641891479,
        0.568695652173913,
        0.3804440592954399,
        0.3911968914359599,
        0.7667503029682353,
        0.5886836541671303,
        0.4856517741066049,
        0.6960249691875261,
        0.372048444715518,
        0.5553005492663555,
        0.5983530322265294,
        0.660643265823947,
        0.38582113431846277,
        0.665121883399759,
        0.7677441476263209,
        0.6131105455154983,
        0.6539130434782608,
        0.6609366127730791,
        0.3806941598755257,
        0.5233324985391101,
        0.7407951138102724,
        0.49126445983592304,
        0.5543058222397185,
        0.6992010828298835,
        0.7505061299451715,
        0.008719952389577457
      ]
    }
  ],
  "series_type": "aggregation-data-series",
  "visualization": {
    "available_metrics": [
      "DS"
    ],
    "type": "box-plot",
    "axes_scale": "linear"
  },
  "labels": [
    {
      "label": "ASFL-HULAFE-Submodule",
      "dataset_orig_id": "EUCAIM:PoC-2025_Segmentation_ASFL-HULAFE-Submodule_P"
    },
    {
      "label": "ASFL-HULAFE",
      "dataset_orig_id": "EUCAIM:PoC-2025_Segmentation_ASFL-HULAFE_P"
    },
    {
      "label": "MITS-ErasmusMC",
      "dataset_orig_id": "EUCAIM:PoC-2025_Segmentation_MITS-ErasmusMC_P"
    }
  ]
}
